url,alt,caption,link
"/images/bloc/bloc-home-01.jpg","Woman and school children laughing and dancing","",""
"/images/bloc/bloc-home-02.jpg","Woman displaying BLOC bag","",""
"/images/bloc/bloc-home-03.jpg","Two teenage girls at a desk","",""
"/images/bloc/bloc-home-04.jpg","A small clay sculpture","",""
"/images/bloc/bloc-home-05.jpg","BLOC cup cakes","",""
"/images/bloc/bloc-home-06.jpg","A girl reading a book","",""
"/images/bloc/bloc-home-07.jpg","People sat in chairs talking","",""
"/images/bloc/bloc-home-08.jpg","iPad picture of a woman in glasses","",""
"/images/bloc/bloc-home-09.jpg","People cheering behind a desk","",""
